{
  "$schema": "https://kumakumapon.github.io/stack-chan/web/schemas/stackchan-mod.schema.json",
  "format": "tech.stackchan.mod",
  "schemaVersion": 1,
  "id": "tech.stackchan.samples.block-buttons",
  "version": "1.0.0",
  "type": "block",
  "name": "ボタンでリアクション",
  "description": "A、B、Cボタンごとに違う表情とせりふを実行します。",
  "author": "Stack-chan Community",
  "license": "Apache-2.0",
  "source": {
    "path": "buttons.stackchan-blocks.json"
  },
  "targets": ["m5stackchan-cores3"],
  "capabilities": ["face", "audio.speech", "input.buttons"]
}
