{
  "$schema": "https://kumakumapon.github.io/stack-chan/web/schemas/stackchan-mod.schema.json",
  "format": "tech.stackchan.mod",
  "schemaVersion": 1,
  "id": "sample.stackchan-minigames",
  "version": "1.0.0",
  "type": "text",
  "name": "ｽﾀｯｸﾁｬﾝ ミニゲーム集",
  "description": "1つのMODでJUMPとCATCHを収録。障害物を飛び越えるアクションと、アイテムを集めて爆弾を避けるゲーム&ウォッチ風ゲームを遊べます。",
  "author": "Stack-chan Community",
  "license": "Apache-2.0 AND MIT",
  "source": {
    "path": "miniapp/manifest.json"
  },
  "entrypoints": ["miniapp"],
  "targets": ["m5stackchan-cores3", "simulator"],
  "capabilities": [],
  "artifacts": [
    {
      "format": "xsa",
      "path": "stackchan-minigames.xsa",
      "target": "m5stackchan-cores3"
    }
  ]
}
